{
  "findings": [],
  "generated_at": "2026-09-30T12:00:00Z",
  "honeypot": {
    "caught_rate": 1.0,
    "injected": 4,
    "triggered": 0
  },
  "io_errors": [],
  "leak_counts": {},
  "machinery_errors": [],
  "ruleset_version": "1.1.0",
  "run_id": "sandbox-golden-clean",
  "scanned": {
    "episodes": 1,
    "memory_entries": 1,
    "steps": 40
  },
  "scope": "leak",
  "verdict": "clean",
  "visible_set": {
    "harness_version": 1,
    "memory_entries": 1,
    "obs_digests": [
      "sha256:7e81462dccff34c19c77d46bed56bd4b35ea6b4eb23939e889dc9d4736c5df38",
      "sha256:de91cabb53c23fb5bc9b7b9d31c7bbd394d328eb94ef941dd7fda2e422699697",
      "sha256:921fbac589978bc152d0fae95c2c6517f7a6022c4b2171a4d5ad0a873605bb4b",
      "sha256:1d53a4d227ef27d537723baa833f11e16da68cca7d5b02741bc5f68f708bf083",
      "sha256:defe7ef895b62f6f645e76016d9b62dab9212cff8517bfd8357a793a97dd1f09",
      "sha256:3ad3e4c8fe73d089174a4f89a6fe4bd4197d68101a3dbdfc6494d6e9b1d65c2d",
      "sha256:4061fa99e8f28cad45900a687c4e3be11689a23fbfb1603d02b27a29061ad0ad",
      "sha256:3d951a5e61a52f235adcbc4a1ac5db59e754a35d451eaaf54b9bacb8e64788fe",
      "sha256:b405c82d1b8497dce17209dd56edbf16b87e8226db3856f0e9a114b672a74c93",
      "sha256:2e410e4fe41d8d4118143a9e5857eebb451313de8ce9769af67bf6f5963b773e",
      "sha256:ee90c76bc160618a0e1946439d4f3a72b32801b3713ded1492ce40a19a5f29ec",
      "sha256:0d152dbf379b6da1f08cfc9daa181a9ff41c1d56faa94e10780c562bc74a493b",
      "sha256:465266004a478392571e35aca38bf3570fadb702c860f1e6e22cfed9702374e2",
      "sha256:8c9bbb7c4d5a5e0868be43bf5a859f290131ea291b013b2f574ee4237fc2a87d",
      "sha256:1f40c38eddcc4e527c613247351c51157c6c4a698ecd0113bf281bce8425871b",
      "sha256:cbdfc67decad85b33ce48cf304d8b112f2d9c60c8c0ecd21704787cb2df1165f",
      "sha256:932d7598eb83d773d20874bbf784005872d6919522bc9b8302e9be086e09d287",
      "sha256:329aa5128ed43e27467d60cb74ec5fa21c44f40e1541aedca016dcc01206a667",
      "sha256:1e2fcb1c6e346eb4a5bfb3d796c23acd62e9717010680d799e6cd1733cb20a3a",
      "sha256:5f9dcabbabd95574308b9ecbb2e5570d649a863bf041a38fac906d7817ca5a57",
      "sha256:3be2b8bcfd1f6fffaf9720888bba51eeea9e0688de638db9a7606c779d31227e",
      "sha256:e3f3731cd46d9d3ff3b4999975aae3607f6208efde0b4f4abb1086c5da0e233e",
      "sha256:503a2439f460f980d6ba1ba739a86d125e07c07762865537e1fa0975d4ee5b3d",
      "sha256:b80cad3577c8c6bd5d4d46e79a372a24e6480043d75395b48d4b25271419904a",
      "sha256:a2ae691bfcadc57a410a8f945f99166bb2da372337186845fb8fcbff42057300",
      "sha256:bbb4f8828ea2c633ee09bc47f270fde6fcf685f4da214c6e83ca80f3b88b0c8b",
      "sha256:7ef909f18f57af8881f55b34df43c35d66b0e27009a4defc4babacecc60c5e17",
      "sha256:c99be3d3ee19d6eb28b750c59e3470feeb06125b5ceb876cc23c904d4dbd3272",
      "sha256:518a2b9ee4bcdc113cd881ba51e881f5a360f6a2bd01521457de08fb621dc905",
      "sha256:f1d3c8769474f16a818969d4eba0a24107bd0fab9f8b42949d3834a032631e37",
      "sha256:ea195bf71e404ce9cce313e07eb926d74e81ab37f559470fcbda366df111af28",
      "sha256:12f524bdba049fb3bceedfa7e74497135b03ab9778e8cc595c94be16a382c200",
      "sha256:88476e7cc855e3db01bb25c190b4ed0332f0096e2763f8cd5081e56ab4457afd",
      "sha256:0950fde93de6bac6ab78d9ae3315810b2ab6d60a5764f01fbf5beca5fce77447",
      "sha256:4e03cad5e68a6bad50b7efb94dfc6072aefd8323dbd6c2af0a07a225dd827fcc",
      "sha256:7b81b31d9019f5ed0f0393a1b7b5f846a048a45b4f755008ce0639c823854932",
      "sha256:26901e6a94fad203bdc5b23bc85417a30eaad8ea9a1fa5187af2d7584a37e880",
      "sha256:bc42261cdbe03d40aa80aad1633a2bb89c77784014a62e2b4f389ae47bac8a19",
      "sha256:3d4b465e904c439889b5200133b51a87a13b74c38b823cd2ff49f2b2b06e8700",
      "sha256:2c99ac6d389245c52e531190ed0ab6bf96086631f53c8c0947b7d9c32dcaa584"
    ],
    "obs_paths": [
      "chapter",
      "decisionIndex",
      "difficulty",
      "enemies",
      "episodeId",
      "event",
      "forge",
      "hand",
      "lastResult",
      "legalActionKinds",
      "map",
      "pendingRelic",
      "phase",
      "player.abilities",
      "player.deckSchool",
      "player.hearts",
      "player.heartsMax",
      "player.purifyLeft",
      "player.starShards",
      "player.statuses",
      "player.virtue",
      "player.virtueMax",
      "player.ward",
      "relics",
      "rest",
      "schemaVersion",
      "shop",
      "shrine",
      "slots",
      "stage",
      "stageCount",
      "toggles",
      "treasure",
      "turn"
    ],
    "seeds_seen": [
      1000
    ]
  },
  "warnings": []
}
